Title,Urls,Updated_Date,Updated_Time
"Susan Gillies, NETS Marketing and Operations Director, Named New Executive Director of NETS",https://www.businesswire.com/news/home/20211001005587/en/Susan-Gillies-NETS-Marketing-and-Operations-Director-Named-New-Executive-Director-of-NETS,10/01/2021 , 12:21 PM
Alcohol Dependence: 2021 Industry Overview and Opportunity Assessment by Drugs & Countries - ResearchAndMarkets.com,https://www.businesswire.com/news/home/20211001005586/en/Alcohol-Dependence-2021-Industry-Overview-and-Opportunity-Assessment-by-Drugs-Countries---ResearchAndMarkets.com,10/01/2021 , 12:20 PM
34 Ameriprise Financial Advisors Named to the Forbes “Top Next-Gen Wealth Advisors” List,https://www.businesswire.com/news/home/20211001005584/en/34-Ameriprise-Financial-Advisors-Named-to-the-Forbes-%E2%80%9CTop-Next-Gen-Wealth-Advisors%E2%80%9D-List,10/01/2021 , 12:16 PM
"Ahead of NASDAQ Listing, Aurora CEO Chris Urmson and Aurora Investor and Board Member Reid Hoffman to Host Company’s First-ever Reddit ‘Ask Me Anything’",https://www.businesswire.com/news/home/20211001005583/en/Ahead-of-NASDAQ-Listing-Aurora-CEO-Chris-Urmson-and-Aurora-Investor-and-Board-Member-Reid-Hoffman-to-Host-Company%E2%80%99s-First-ever-Reddit-%E2%80%98Ask-Me-Anything%E2%80%99,10/01/2021 , 12:13 PM
Bank of New York Mellon UK Regulatory Announcement: FRN Variable Rate Fix,https://www.businesswire.com/news/home/20211001005582/en/Bank-of-New-York-Mellon-UK-Regulatory-Announcement-FRN-Variable-Rate-Fix,10/01/2021 , 12:12 PM
Overview of Global Patent Foramen Ovale (PFO) Closure Devices 2021 - 2026 - ResearchAndMarkets.com,https://www.businesswire.com/news/home/20211001005581/en/Overview-of-Global-Patent-Foramen-Ovale-PFO-Closure-Devices-2021---2026---ResearchAndMarkets.com,10/01/2021 , 12:11 PM
Bank of New York Mellon UK Regulatory Announcement: FRN Variable Rate Fix,https://www.businesswire.com/news/home/20211001005580/en/Bank-of-New-York-Mellon-UK-Regulatory-Announcement-FRN-Variable-Rate-Fix,10/01/2021 , 12:11 PM
Bank of New York Mellon UK Regulatory Announcement: FRN Variable Rate Fix,https://www.businesswire.com/news/home/20211001005579/en/Bank-of-New-York-Mellon-UK-Regulatory-Announcement-FRN-Variable-Rate-Fix,10/01/2021 , 12:09 PM
Big Whale Labs Raises $655K in Pre-Seed Funding Led by Slow Ventures,https://www.businesswire.com/news/home/20211001005194/en/Big-Whale-Labs-Raises-655K-in-Pre-Seed-Funding-Led-by-Slow-Ventures,10/01/2021 , 12:09 PM
Bank of New York Mellon UK Regulatory Announcement: FRN Variable Rate Fix,https://www.businesswire.com/news/home/20211001005578/en/Bank-of-New-York-Mellon-UK-Regulatory-Announcement-FRN-Variable-Rate-Fix,10/01/2021 , 12:07 PM
Bank of New York Mellon UK Regulatory Announcement: FRN Variable Rate Fix,https://www.businesswire.com/news/home/20211001005575/en/Bank-of-New-York-Mellon-UK-Regulatory-Announcement-FRN-Variable-Rate-Fix,10/01/2021 , 12:05 PM
Igloo to Donate 100% of the Sales Price of 2022 Playmate Calendars Sold to the American Cancer Society,https://www.businesswire.com/news/home/20211001005574/en/Igloo-to-Donate-100-of-the-Sales-Price-of-2022-Playmate-Calendars-Sold-to-the-American-Cancer-Society,10/01/2021 , 12:05 PM
"Schroders Global Investor Study 2021: Many Canadian Investors Interested in ESG, but Lag Global Counterparts",https://www.businesswire.com/news/home/20211001005573/en/Schroders-Global-Investor-Study-2021-Many-Canadian-Investors-Interested-in-ESG-but-Lag-Global-Counterparts,10/01/2021 , 12:04 PM
"AM Best Withdraws Credit Ratings of Ocaso, S.A. Seguros y Reaseguros",https://www.businesswire.com/news/home/20211001005572/en/AM-Best-Withdraws-Credit-Ratings-of-Ocaso-S.A.-Seguros-y-Reaseguros,10/01/2021 , 12:04 PM
"Global Irrigation Machinery Market 2021-2026 | A $6.6+ Billion Opportunity Assessment by Type, Application and Region - ResearchAndMarkets.com",https://www.businesswire.com/news/home/20211001005570/en/Global-Irrigation-Machinery-Market-2021-2026-A-6.6-Billion-Opportunity-Assessment-by-Type-Application-and-Region---ResearchAndMarkets.com,10/01/2021 , 12:01 PM
Colossal Biosciences and the Vertebrate Genomes Project Will Preserve the Genetic Code of all Endangered Elephant Species Through Genomic Sequencing,https://www.businesswire.com/news/home/20211001005558/en/Colossal-Biosciences-and-the-Vertebrate-Genomes-Project-Will-Preserve-the-Genetic-Code-of-all-Endangered-Elephant-Species-Through-Genomic-Sequencing,10/01/2021 , 12:00 PM
"Tech Data, a Legacy Company of TD SYNNEX Receives FY21 Americas Distributor of the Year Award from Cohesity",https://www.businesswire.com/news/home/20211001005068/en/Tech-Data-a-Legacy-Company-of-TD-SYNNEX-Receives-FY21-Americas-Distributor-of-the-Year-Award-from-Cohesity,10/01/2021 , 12:00 PM
"KBRA Releases Research – Consumer ABS Trend Watch: Record Issuance, Stellar Credit Performance",https://www.businesswire.com/news/home/20211001005569/en/KBRA-Releases-Research-%E2%80%93-Consumer-ABS-Trend-Watch-Record-Issuance-Stellar-Credit-Performance,10/01/2021 , 11:54 AM
MediaLink Hires Global Brand Leader David Muldoon in Europe,https://www.businesswire.com/news/home/20211001005568/en/MediaLink-Hires-Global-Brand-Leader-David-Muldoon-in-Europe,10/01/2021 , 11:54 AM
Nickelodeon Adds Mike & Molly to Nick at Nite’s Hit Comedy Lineup Beginning Oct. 4,https://www.businesswire.com/news/home/20211001005567/en/Nickelodeon-Adds-Mike-Molly-to-Nick-at-Nite%E2%80%99s-Hit-Comedy-Lineup-Beginning-Oct.-4,10/01/2021 , 11:52 AM
Alzheimer's Disease 2021: Global Markets and Shares for Key Drugs by Country - ResearchAndMarkets.com,https://www.businesswire.com/news/home/20211001005566/en/Alzheimers-Disease-2021-Global-Markets-and-Shares-for-Key-Drugs-by-Country---ResearchAndMarkets.com,10/01/2021 , 11:51 AM
The Worldwide Clinical Trial Imaging Industry is Expected to Reach $1.4 billion by 2028 - ResearchAndMarkets.com,https://www.businesswire.com/news/home/20211001005565/en/The-Worldwide-Clinical-Trial-Imaging-Industry-is-Expected-to-Reach-1.4-billion-by-2028---ResearchAndMarkets.com,10/01/2021 , 11:51 AM
Dorsey Commits to Inclusion Blueprint,https://www.businesswire.com/news/home/20211001005562/en/Dorsey-Commits-to-Inclusion-Blueprint,10/01/2021 , 11:49 AM
Bank of New York Mellon UK Regulatory Announcement: Early Repurchase(s),https://www.businesswire.com/news/home/20211001005564/en/Bank-of-New-York-Mellon-UK-Regulatory-Announcement-Early-Repurchase-s,10/01/2021 , 11:49 AM
EMEA Water Desalination Pumps Market To Progress at a CAGR of 2.58% Between 2021-2025 - ResearchAndMarkets.com,https://www.businesswire.com/news/home/20211001005563/en/EMEA-Water-Desalination-Pumps-Market-To-Progress-at-a-CAGR-of-2.58-Between-2021-2025---ResearchAndMarkets.com,10/01/2021 , 11:49 AM
Bank of New York Mellon UK Regulatory Announcement: Early Repurchase(s),https://www.businesswire.com/news/home/20211001005561/en/Bank-of-New-York-Mellon-UK-Regulatory-Announcement-Early-Repurchase-s,10/01/2021 , 11:48 AM
Xtrackers II UK Regulatory Announcement: Net Asset Value(s),https://www.businesswire.com/news/home/20211001005559/en/Xtrackers-II-UK-Regulatory-Announcement-Net-Asset-Value-s,10/01/2021 , 11:47 AM
MedinCell : Information mensuelle relative au nombre d’actions composant le capital social et au nombre total des droits de vote,https://www.businesswire.com/news/home/20211001005521/fr,10/01/2021 , 11:45 AM
Riassunto: Mountfort Investments – Supporto per candidati al Consiglio di vigilanza di IMMOFINANZ,https://www.businesswire.com/news/home/20211001005556/it,10/01/2021 , 11:42 AM
Mountfort Investments – Unterstützung für Aufsichtsratskandidaten der IMMOFINANZ,https://www.businesswire.com/news/home/20211001005557/de,10/01/2021 , 11:42 AM
Allstate Closes Sale of New York Life and Annuity Businesses,https://www.businesswire.com/news/home/20211001005555/en/Allstate-Closes-Sale-of-New-York-Life-and-Annuity-Businesses,10/01/2021 , 11:41 AM
イーグルアイネットワークスが監視AIリーダー企業のアンキャニー・ビジョンを買収,https://www.businesswire.com/news/home/20211001005554/ja,10/01/2021 , 11:40 AM
"Ophthalmic Lasers Market to 2028: Global Leading Players Include Quantel Medical, Lumenis, Aurolab and Alcon - ResearchAndMarkets.com",https://www.businesswire.com/news/home/20211001005553/en/Ophthalmic-Lasers-Market-to-2028-Global-Leading-Players-Include-Quantel-Medical-Lumenis-Aurolab-and-Alcon---ResearchAndMarkets.com,10/01/2021 , 11:40 AM
"Global Insomnia Market Insights 2018-2026: Pipeline, Epidemiology, Drug Sales, and Market Shares - ResearchAndMarkets.com",https://www.businesswire.com/news/home/20211001005552/en/Global-Insomnia-Market-Insights-2018-2026-Pipeline-Epidemiology-Drug-Sales-and-Market-Shares---ResearchAndMarkets.com,10/01/2021 , 11:37 AM
Notice to the Holders of The 274 999 943.70€ 0.125% Bonds due 07 September 2026 Issued by REMY COINTREAU (the Issuer) and Convertible Into New Shares and or Exchangeable for Existing Shares of REMY COINTREAU (the Bonds),https://www.businesswire.com/news/home/20211001005530/en/Notice-to-the-Holders-of-The-274-999-943.70%E2%82%AC-0.125-Bonds-due-07-September-2026-Issued-by-REMY-COINTREAU-the-Issuer-and-Convertible-Into-New-Shares-and-or-Exchangeable-for-Existing-Shares-of-REMY-COINTREAU-the-Bonds,10/01/2021 , 11:35 AM
"Kirstin Marr, Head of Insurity Analytics, Leads Panel Discussion on Next-Generation Analytics at InsureTech Connect 2021",https://www.businesswire.com/news/home/20211001005551/en/Kirstin-Marr-Head-of-Insurity-Analytics-Leads-Panel-Discussion-on-Next-Generation-Analytics-at-InsureTech-Connect-2021,10/01/2021 , 11:35 AM
The Law Offices of Frank R. Cruz Announces the Filing of a Securities Class Action on Behalf of Hyzon Motors Inc. f/k/a Decarbonization Plus Acquisition Corporation (HYZN) Investors,https://www.businesswire.com/news/home/20211001005226/en/The-Law-Offices-of-Frank-R.-Cruz-Announces-the-Filing-of-a-Securities-Class-Action-on-Behalf-of-Hyzon-Motors-Inc.-fka-Decarbonization-Plus-Acquisition-Corporation-HYZN-Investors,10/01/2021 , 11:35 AM
eMaxx Enters Its Fourth Year of Operations as a Captive Program Administrator Surpassing $100M With Technology Focused Model Proven to Drive Down Loss Cost,https://www.businesswire.com/news/home/20211001005541/en/eMaxx-Enters-Its-Fourth-Year-of-Operations-as-a-Captive-Program-Administrator-Surpassing-100M-With-Technology-Focused-Model-Proven-to-Drive-Down-Loss-Cost,10/01/2021 , 11:30 AM
Acquired Hemophilia Treatment Market 2021 to 2029: Increasing Prevalence of AH among New Born Demands Effective Treatment - ResearchAndMarkets.com,https://www.businesswire.com/news/home/20211001005550/en/Acquired-Hemophilia-Treatment-Market-2021-to-2029-Increasing-Prevalence-of-AH-among-New-Born-Demands-Effective-Treatment---ResearchAndMarkets.com,10/01/2021 , 11:29 AM
"Frank Poore, l'entrepreneur américain chevronné du commerce électronique rejoint le conseil d'administration d'ENGAGE XR",https://www.businesswire.com/news/home/20211001005549/fr,10/01/2021 , 11:28 AM
NWFCU Foundation Donates $20K to Northern Virginia Community College’s Student Support Programs,https://www.businesswire.com/news/home/20211001005547/en/NWFCU-Foundation-Donates-20K-to-Northern-Virginia-Community-College%E2%80%99s-Student-Support-Programs,10/01/2021 , 11:26 AM
"Global Order Management Software (OMS) Market, 2021: Overview, Trends, Drivers & Barriers, Vendor Positioning Maps, Leading Vendor Profiles - ResearchAndMarkets.com",https://www.businesswire.com/news/home/20211001005546/en/Global-Order-Management-Software-OMS-Market-2021-Overview-Trends-Drivers-Barriers-Vendor-Positioning-Maps-Leading-Vendor-Profiles---ResearchAndMarkets.com,10/01/2021 , 11:24 AM
Global Hypertension Market Overview and Forecast 2018-2026 - ResearchAndMarkets.com,https://www.businesswire.com/news/home/20211001005545/en/Global-Hypertension-Market-Overview-and-Forecast-2018-2026---ResearchAndMarkets.com,10/01/2021 , 11:23 AM
North America Garage Furniture Market Growth Fuelled by DIY Trends and Increased Number of Independent Garages - ResearchAndMarkets.com,https://www.businesswire.com/news/home/20211001005544/en/North-America-Garage-Furniture-Market-Growth-Fuelled-by-DIY-Trends-and-Increased-Number-of-Independent-Garages---ResearchAndMarkets.com,10/01/2021 , 11:21 AM
Le tribunal donne raison à Eurofins Viracor dans l'affaire de contrefaçon de brevet,https://www.businesswire.com/news/home/20211001005543/fr,10/01/2021 , 11:20 AM
Publix Announces Quarterly Dividend,https://www.businesswire.com/news/home/20211001005542/en/Publix-Announces-Quarterly-Dividend,10/01/2021 , 11:18 AM
City of Los Angeles Deputy Mayor Breelyn Pete Joins McGuireWoods Consulting,https://www.businesswire.com/news/home/20211001005540/en/City-of-Los-Angeles-Deputy-Mayor-Breelyn-Pete-Joins-McGuireWoods-Consulting,10/01/2021 , 11:14 AM
GML y EZ-WHEEL se asocian para llevar una exclusiva rueda de tracción equipada con IA a robots móviles autónomos,https://www.businesswire.com/news/home/20211001005538/es,10/01/2021 , 11:11 AM
Samenvatting: GML en EZ-WHEEL werken samen om een unieke AI-aangedreven wielaandrijving naar Autonomous Mobile Robots te brengen,https://www.businesswire.com/news/home/20211001005539/nl,10/01/2021 , 11:11 AM
