Title,Urls,Updated_Date,Updated_Time
"Expro and Frank’s Complete Merger, Creating a New Full-Cycle Energy Services Leader",https://www.businesswire.com/news/home/20211001005603/en/Expro-and-Frank%E2%80%99s-Complete-Merger-Creating-a-New-Full-Cycle-Energy-Services-Leader,10/01/2021 , 04:05 PM
"Sixth Street Specialty Lending, Inc. Schedules Earnings Release and Conference Call to Discuss its Third Quarter Ended September 30, 2021 Financial Results",https://www.businesswire.com/news/home/20211001005638/en/Sixth-Street-Specialty-Lending-Inc.-Schedules-Earnings-Release-and-Conference-Call-to-Discuss-its-Third-Quarter-Ended-September-30-2021-Financial-Results,10/01/2021 , 04:05 PM
"Manitowoc Completes Acquisition of the Crane Business of H&E Equipment Services, Inc.",https://www.businesswire.com/news/home/20211001005684/en/Manitowoc-Completes-Acquisition-of-the-Crane-Business-of-HE-Equipment-Services-Inc.,10/01/2021 , 04:05 PM
Capital Senior Living Enters into Amended and Restated Investment Agreement with Conversant Capital,https://www.businesswire.com/news/home/20211001005692/en/Capital-Senior-Living-Enters-into-Amended-and-Restated-Investment-Agreement-with-Conversant-Capital,10/01/2021 , 04:05 PM
Xeris Pharmaceuticals Announces Inducement Grants Under NASDAQ Listing Rule 5635(c)(4),https://www.businesswire.com/news/home/20211001005006/en/Xeris-Pharmaceuticals-Announces-Inducement-Grants-Under-NASDAQ-Listing-Rule-5635-c-4,10/01/2021 , 04:05 PM
"Cal-Maine Foods, Inc. Announces Promotions of Sales Team",https://www.businesswire.com/news/home/20211001005632/en/Cal-Maine-Foods-Inc.-Announces-Promotions-of-Sales-Team,10/01/2021 , 04:05 PM
E*TRADE Releases Monthly Sector Rotation Study,https://www.businesswire.com/news/home/20211001005643/en/E*TRADE-Releases-Monthly-Sector-Rotation-Study,10/01/2021 , 04:05 PM
Shelley Leibowitz Elected to Elastic’s Board of Directors,https://www.businesswire.com/news/home/20211001005685/en/Shelley-Leibowitz-Elected-to-Elastic%E2%80%99s-Board-of-Directors,10/01/2021 , 04:05 PM
"BlackRock Capital Investment Corporation to Report Third Quarter 2021 Earnings on November 3, 2021",https://www.businesswire.com/news/home/20211001005505/en/BlackRock-Capital-Investment-Corporation-to-Report-Third-Quarter-2021-Earnings-on-November-3-2021,10/01/2021 , 04:01 PM
"Mike Paciello joins AbleDocs as Vice President, United States",https://www.businesswire.com/news/home/20211001005695/en/Mike-Paciello-joins-AbleDocs-as-Vice-President-United-States,10/01/2021 , 04:01 PM
McGrath RentCorp Sets Third Quarter 2021 Financial Results Date and Time,https://www.businesswire.com/news/home/20211001005131/en/McGrath-RentCorp-Sets-Third-Quarter-2021-Financial-Results-Date-and-Time,10/01/2021 , 04:01 PM
MEI Pharma Announces Inducement Grant Under Nasdaq Listing Rule 5635(c)(4),https://www.businesswire.com/news/home/20211001005571/en/MEI-Pharma-Announces-Inducement-Grant-Under-Nasdaq-Listing-Rule-5635-c-4,10/01/2021 , 04:00 PM
GAN Postpones Investor Event Previously Scheduled for October 4,https://www.businesswire.com/news/home/20211001005674/en/GAN-Postpones-Investor-Event-Previously-Scheduled-for-October-4,10/01/2021 , 04:00 PM
Cirrus Logic to Announce Q2 Results November 1,https://www.businesswire.com/news/home/20211001005099/en/Cirrus-Logic-to-Announce-Q2-Results-November-1,10/01/2021 , 04:00 PM
Beemok Capital Completes Acquisition of Charleston Place,https://www.businesswire.com/news/home/20211001005687/en/Beemok-Capital-Completes-Acquisition-of-Charleston-Place,10/01/2021 , 04:00 PM
"Chevron, Mercuria Finalize CNG Fueling Network Joint Venture",https://www.businesswire.com/news/home/20211001005593/en/Chevron-Mercuria-Finalize-CNG-Fueling-Network-Joint-Venture,10/01/2021 , 04:00 PM
"Grange Insurance Names John North President of Commercial Lines, Cheryl McRae Lebens President of Personal Lines",https://www.businesswire.com/news/home/20211001005686/en/Grange-Insurance-Names-John-North-President-of-Commercial-Lines-Cheryl-McRae-Lebens-President-of-Personal-Lines,10/01/2021 , 04:00 PM
INVESTIGATION REMINDER: The Schall Law Firm Announces it is Investigating Claims Against Lightspeed Commerce Inc. and Encourages Investors with Losses to Contact the Firm,https://www.businesswire.com/news/home/20211001005691/en/INVESTIGATION-REMINDER-The-Schall-Law-Firm-Announces-it-is-Investigating-Claims-Against-Lightspeed-Commerce-Inc.-and-Encourages-Investors-with-Losses-to-Contact-the-Firm,10/01/2021 , 03:51 PM
SHAREHOLDER ALERT: Robbins LLP Announces that Hyzon Motors Inc. (HYZN) f/k/a Decarbonization Plus Acquisition Corporation (DCRB) is Being Sued for Misleading Shareholders,https://www.businesswire.com/news/home/20211001005690/en/SHAREHOLDER-ALERT-Robbins-LLP-Announces-that-Hyzon-Motors-Inc.-HYZN-fka-Decarbonization-Plus-Acquisition-Corporation-DCRB-is-Being-Sued-for-Misleading-Shareholders,10/01/2021 , 03:46 PM
Statement From Attorneys Phil Brewster of Brewster Law Firm and Patrick Mincey of Cranfill Sumner,https://www.businesswire.com/news/home/20211001005688/en/Statement-From-Attorneys-Phil-Brewster-of-Brewster-Law-Firm-and-Patrick-Mincey-of-Cranfill-Sumner,10/01/2021 , 03:38 PM
"ASM Global Set to Unveil Spectacular Capital One Hall Tonight, One of the Country’s Most Unique Private/Public Venue Partnerships … It Also Will Have a Golf Course on the Roof",https://www.businesswire.com/news/home/20211001005683/en/ASM-Global-Set-to-Unveil-Spectacular-Capital-One-Hall-Tonight-One-of-the-Country%E2%80%99s-Most-Unique-PrivatePublic-Venue-Partnerships-%E2%80%A6-It-Also-Will-Have-a-Golf-Course-on-the-Roof,10/01/2021 , 03:19 PM
Glass Mountain Announces Entry Into Restructuring Support Agreement With Over Two-Thirds of Lenders to Effectuate Comprehensive Balance-Sheet Restructuring,https://www.businesswire.com/news/home/20211001005682/en/Glass-Mountain-Announces-Entry-Into-Restructuring-Support-Agreement-With-Over-Two-Thirds-of-Lenders-to-Effectuate-Comprehensive-Balance-Sheet-Restructuring,10/01/2021 , 03:15 PM
D.A. Davidson & Co. Acts as Exclusive Financial Advisor to WISP in Its Majority Stake Acquisition by WELL Health Technologies Corp.,https://www.businesswire.com/news/home/20211001005681/en/D.A.-Davidson-Co.-Acts-as-Exclusive-Financial-Advisor-to-WISP-in-Its-Majority-Stake-Acquisition-by-WELL-Health-Technologies-Corp.,10/01/2021 , 03:11 PM
Baron & Budd Helps Achieve a $1.8 Billion Settlement with Southern California Gas Company for Historic Aliso Canyon Gas Blowout,https://www.businesswire.com/news/home/20211001005680/en/Baron-Budd-Helps-Achieve-a-1.8-Billion-Settlement-with-Southern-California-Gas-Company-for-Historic-Aliso-Canyon-Gas-Blowout,10/01/2021 , 03:09 PM
AM Best Maintains Under Review with Negative Implications Status for Credit Ratings of Armour Secure Insurance S.A. de C.V.,https://www.businesswire.com/news/home/20211001005678/en/AM-Best-Maintains-Under-Review-with-Negative-Implications-Status-for-Credit-Ratings-of-Armour-Secure-Insurance-S.A.-de-C.V.,10/01/2021 , 03:06 PM
AM Best Mantiene el Estado de Bajo Revisión con Implicaciones Negativas para las Calificaciones Crediticias de Armour Secure Insurance S.A. de C.V.,https://www.businesswire.com/news/home/20211001005679/es,10/01/2021 , 03:06 PM
Epsilyte Acquires StyroChem to Expand Capacity and Customer Solutions,https://www.businesswire.com/news/home/20211001005644/en/Epsilyte-Acquires-StyroChem-to-Expand-Capacity-and-Customer-Solutions,10/01/2021 , 03:00 PM
Erek L. Barron Next U.S. Attorney for Maryland,https://www.businesswire.com/news/home/20211001005675/en/Erek-L.-Barron-Next-U.S.-Attorney-for-Maryland,10/01/2021 , 02:57 PM
"Textron to Release Third Quarter Results on October 28, 2021",https://www.businesswire.com/news/home/20211001005672/en/Textron-to-Release-Third-Quarter-Results-on-October-28-2021,10/01/2021 , 02:51 PM
"Samenvatting: Exscientia kondigt prijsverhoging aan van $ 304,7 miljoen opgewaardeerde beursintroductie en $ 160,0 miljoen gelijktijdige private plaatsingen",https://www.businesswire.com/news/home/20211001005671/nl,10/01/2021 , 02:45 PM
AM Best Downgrades Credit Ratings of Independent Mutual Fire Insurance Company,https://www.businesswire.com/news/home/20211001005670/en/AM-Best-Downgrades-Credit-Ratings-of-Independent-Mutual-Fire-Insurance-Company,10/01/2021 , 02:44 PM
Exclusive Networks: Stabilisation Period Announcement,https://www.businesswire.com/news/home/20211001005668/en/Exclusive-Networks%C2%A0Stabilisation-Period-Announcement,10/01/2021 , 02:37 PM
Exclusive Networks : Opérations de stabilisation,https://www.businesswire.com/news/home/20211001005669/fr,10/01/2021 , 02:37 PM
"Samenvatting: CFRA kondigt overname aan van Washington Analysis, LLC",https://www.businesswire.com/news/home/20211001005665/nl,10/01/2021 , 02:35 PM
"Riassunto: CFRA annuncia l'acquisizione di Washington Analysis, LLC",https://www.businesswire.com/news/home/20211001005666/it,10/01/2021 , 02:35 PM
Philippine Airlines Inc. (PAL) Receives U.S. Court Approval to Access US$505 Million in Debtor-in-Possession (“DIP”) Financing,https://www.businesswire.com/news/home/20211001005664/en/Philippine-Airlines-Inc.-PAL-Receives-U.S.-Court-Approval-to-Access-US505-Million-in-Debtor-in-Possession-%E2%80%9CDIP%E2%80%9D-Financing,10/01/2021 , 02:34 PM
PrimeLending’s Cindy Buhr Wins HousingWire Vanguard Award,https://www.businesswire.com/news/home/20211001005663/en/PrimeLending%E2%80%99s-Cindy-Buhr-Wins-HousingWire-Vanguard-Award,10/01/2021 , 02:28 PM
"Placé sous la devise «Fashion Futian ! Explore Globally», le forum Shenzhen Futian Fashion Investment Paris 2021 a été lancé avec succès",https://www.businesswire.com/news/home/20211001005661/fr,10/01/2021 , 02:22 PM
Shenzhen Futian Fashion Investment 2021 Paris Forum unter dem Motto „Mode Futian! Weltweit ergründen“ erfolgreich durchgeführt,https://www.businesswire.com/news/home/20211001005662/de,10/01/2021 , 02:22 PM
AM Best Places Credit Ratings of Members of AmFed Insurance Group Under Review With Positive Implications,https://www.businesswire.com/news/home/20211001005660/en/AM-Best-Places-Credit-Ratings-of-Members-of-AmFed-Insurance-Group-Under-Review-With-Positive-Implications,10/01/2021 , 02:18 PM
ムーディーズが自然関連財務情報開示タスクフォース（TNFD）に参加し、報告枠組みの構築を支援,https://www.businesswire.com/news/home/20211001005659/ja,10/01/2021 , 02:16 PM
Templeton Emerging Markets Income Fund (“TEI” or the “Fund”) Announces Distribution,https://www.businesswire.com/news/home/20211001005658/en/Templeton-Emerging-Markets-Income-Fund-%E2%80%9CTEI%E2%80%9D-or-the-%E2%80%9CFund%E2%80%9D-Announces-Distribution,10/01/2021 , 02:13 PM
Healthfirst Announces New OTC Plus Card—with More Ways to Save and More Places to Use It—as Part of Its Medicare Advantage Offerings for 2022,https://www.businesswire.com/news/home/20211001005657/en/Healthfirst-Announces-New-OTC-Plus-Card%E2%80%94with-More-Ways-to-Save-and-More-Places-to-Use-It%E2%80%94as-Part-of-Its-Medicare-Advantage-Offerings-for-2022,10/01/2021 , 02:13 PM
L&T Technology Services amplía la oferta del programa Intel AI Builders con su solución de radiología Chest rAI™,https://www.businesswire.com/news/home/20211001005655/es,10/01/2021 , 02:10 PM
‘Adventure starts where the road ends’ in new 2022 Frontier campaign,https://www.businesswire.com/news/home/20211001005654/en/%E2%80%98Adventure-starts-where-the-road-ends%E2%80%99-in-new-2022-Frontier-campaign,10/01/2021 , 02:09 PM
Integrated Payor Solutions Seals Partnership with Vālenz®,https://www.businesswire.com/news/home/20211001005653/en/Integrated-Payor-Solutions-Seals-Partnership-with-V%C4%81lenz%C2%AE,10/01/2021 , 02:08 PM
CAP Objects to New Rules Implementing No Surprises Act,https://www.businesswire.com/news/home/20211001005652/en/CAP-Objects-to-New-Rules-Implementing-No-Surprises-Act,10/01/2021 , 02:08 PM
Templeton Global Income Fund (“GIM” or the “Fund”) Announces Distribution,https://www.businesswire.com/news/home/20211001005651/en/Templeton-Global-Income-Fund-%E2%80%9CGIM%E2%80%9D-or-the-%E2%80%9CFund%E2%80%9D-Announces-Distribution,10/01/2021 , 02:07 PM
SHI UK Achieves Cisco Gold Integrator Certification,https://www.businesswire.com/news/home/20211001005382/en/SHI-UK-Achieves-Cisco-Gold-Integrator-Certification,10/01/2021 , 02:07 PM
PointsKash Secures Seed Round Investment from Seabury Global Markets,https://www.businesswire.com/news/home/20211001005649/en/PointsKash-Secures-Seed-Round-Investment-from-Seabury-Global-Markets,10/01/2021 , 02:05 PM
APCI: Feds Should Stop UHG’s Proposed Acquisition of Change Healthcare,https://www.businesswire.com/news/home/20211001005650/en/APCI-Feds-Should-Stop-UHG%E2%80%99s-Proposed-Acquisition-of-Change-Healthcare,10/01/2021 , 02:05 PM
"Decarbonization of Air Transportation: Air France, TotalEnergies, the Métropole of Nice Côte d’Azur and Nice Côte d’Azur Airport Carry Out a Nice-Paris Flight Fueled With 30% Sustainable Aviation Fuel",https://www.businesswire.com/news/home/20211001005647/en/Decarbonization-of-Air-Transportation-Air-France-TotalEnergies-the-M%C3%A9tropole-of-Nice-C%C3%B4te-d%E2%80%99Azur-and-Nice-C%C3%B4te-d%E2%80%99Azur-Airport-Carry-Out-a-Nice-Paris-Flight-Fueled-With-30-Sustainable-Aviation-Fuel,10/01/2021 , 02:01 PM
"Décarbonation du transport aérien : Air France, TotalEnergies, la Métropole Nice Côte d’Azur et l’Aéroport Nice Côte d’Azur réalisent un vol Nice-Paris alimenté avec 30% de carburant d’aviation durable (SAF)",https://www.businesswire.com/news/home/20211001005648/fr,10/01/2021 , 02:01 PM
Bayer Issues Voluntary Recall of Specific Lotrimin® and Tinactin® Spray Products Due to the Presence of Benzene,https://www.businesswire.com/news/home/20211001005645/en/Bayer-Issues-Voluntary-Recall-of-Specific-Lotrimin%C2%AE-and-Tinactin%C2%AE-Spray-Products-Due-to-the-Presence-of-Benzene,10/01/2021 , 02:00 PM
Trio-Tech Reports Fourth Quarter and Fiscal 2021 Results,https://www.businesswire.com/news/home/20211001005639/en/Trio-Tech-Reports-Fourth-Quarter-and-Fiscal-2021-Results,10/01/2021 , 02:00 PM
"Cloud Infrastructure Spending Decreased in Second Quarter of 2021 But Is On Track for Growth in the Full Year, According to IDC",https://www.businesswire.com/news/home/20211001005642/en/Cloud-Infrastructure-Spending-Decreased-in-Second-Quarter-of-2021-But-Is-On-Track-for-Growth-in-the-Full-Year-According-to-IDC,10/01/2021 , 01:54 PM
Johns Manville podtrzymuje zobowiązanie do tworzenia lepszego jutra oraz wyznacza cele na 2025 r. w nowym Raporcie Zrównoważonego Rozwoju,https://www.businesswire.com/news/home/20211001005640/pl,10/01/2021 , 01:50 PM
AM Best Assigns Preliminary Credit Assessment to Triangle Life Insurance Co. Ltd.,https://www.businesswire.com/news/home/20211001005636/en/AM-Best-Assigns-Preliminary-Credit-Assessment-to-Triangle-Life-Insurance-Co.-Ltd.,10/01/2021 , 01:44 PM
GML et EZ-WHEEL s'associent pour équiper les robots mobiles autonomes d'une roue motrice sécuritaire SWD à intelligence artificielle unique en son genre,https://www.businesswire.com/news/home/20211001005634/fr,10/01/2021 , 01:42 PM
Ynvisible Interactive nimmt an den bevorstehenden Investorenkonferenzen teil,https://www.businesswire.com/news/home/20211001005633/de,10/01/2021 , 01:41 PM
"GML und EZ-WHEEL arbeiten zusammen, um einen einzigartigen KI-betriebenen Wheel Drive für autonome mobile Roboter bereitzustellen",https://www.businesswire.com/news/home/20211001005631/de,10/01/2021 , 01:37 PM
New Mural Elevating Global Aspirations for Gender Equality is Unveiled in New York,https://www.businesswire.com/news/home/20211001005628/en/New-Mural-Elevating-Global-Aspirations-for-Gender-Equality-is-Unveiled-in-New-York,10/01/2021 , 01:32 PM
Resumen: USB-IF anuncia nuevos logotipos certificados de potencia de cables USB Type-C®,https://www.businesswire.com/news/home/20211001005627/es,10/01/2021 , 01:31 PM
"Eagle Bancorp Merger Investigation: Halper Sadeh LLP Announces Investigation Into Whether the Merger of Eagle Bancorp Montana, Inc. Is Fair to Shareholders; Investors Are Encouraged to Contact the Firm – EBMT",https://www.businesswire.com/news/home/20211001005626/en/Eagle-Bancorp-Merger-Investigation-Halper-Sadeh-LLP-Announces-Investigation-Into-Whether-the-Merger-of-Eagle-Bancorp-Montana-Inc.-Is-Fair-to-Shareholders-Investors-Are-Encouraged-to-Contact-the-Firm-%E2%80%93-EBMT,10/01/2021 , 01:25 PM
"Intelligent Waves Integrates Teradici PCoIP® Technology to Optimize Phantom, Its Award-Winning Cyber-Defense Solution for Ultra-Secure Communications",https://www.businesswire.com/news/home/20211001005624/en/Intelligent-Waves-Integrates-Teradici-PCoIP%C2%AE-Technology-to-Optimize-Phantom-Its-Award-Winning-Cyber-Defense-Solution-for-Ultra-Secure-Communications,10/01/2021 , 01:14 PM
Eutelsat Communications : AVIS DE MISE À DISPOSITION DES DOCUMENTS PREPARATOIRES A L’ASSEMBLEE MIXTE DU 4 NOVEMBRE 2021,https://www.businesswire.com/news/home/20211001005623/fr,10/01/2021 , 01:11 PM
Global Sustainable Clothing Market Outlook: Rapidly Increasing Textile Waste to Drive the Market Through 2026 - ResearchAndMarkets.com,https://www.businesswire.com/news/home/20211001005621/en/Global-Sustainable-Clothing-Market-Outlook-Rapidly-Increasing-Textile-Waste-to-Drive-the-Market-Through-2026---ResearchAndMarkets.com,10/01/2021 , 01:10 PM
Global Virtual Data Room Market with COVID-19 Impact Analysis 2021-2026 - ResearchAndMarkets.com,https://www.businesswire.com/news/home/20211001005620/en/Global-Virtual-Data-Room-Market-with-COVID-19-Impact-Analysis-2021-2026---ResearchAndMarkets.com,10/01/2021 , 01:03 PM
"iFIT Announces Multi-Year Exclusive Connected Treadmill and Content Partnerships With Boston, Chicago, London and New York City Marathons",https://www.businesswire.com/news/home/20211001005619/en/iFIT-Announces-Multi-Year-Exclusive-Connected-Treadmill-and-Content-Partnerships-With-Boston-Chicago-London-and-New-York-City-Marathons,10/01/2021 , 01:01 PM
U.S. Imaging Services Market Report 2021-2028: Increasing Prevalence of Cancer and Cardiac Disorders - ResearchAndMarkets.com,https://www.businesswire.com/news/home/20211001005618/en/U.S.-Imaging-Services-Market-Report-2021-2028-Increasing-Prevalence-of-Cancer-and-Cardiac-Disorders---ResearchAndMarkets.com,10/01/2021 , 01:00 PM
"Alerus Financial Corporation to Announce Third Quarter 2021 Financial Results on Wednesday, October 27",https://www.businesswire.com/news/home/20211001005095/en/Alerus-Financial-Corporation-to-Announce-Third-Quarter-2021-Financial-Results-on-Wednesday-October-27,10/01/2021 , 01:00 PM
La moda de Futian brilla en el mundo; éxito en el lanzamiento del foro de inversión en moda de Shenzhen Futian en París,https://www.businesswire.com/news/home/20211001005617/es,10/01/2021 , 12:59 PM
The Institute for Criminal Justice Training Reform Available for Comment on California’s Historic Passage of Criminal Justice Legislation,https://www.businesswire.com/news/home/20211001005615/en/The-Institute-for-Criminal-Justice-Training-Reform-Available-for-Comment-on-California%E2%80%99s-Historic-Passage-of-Criminal-Justice-Legislation,10/01/2021 , 12:57 PM
Global Hunter Syndrome Epidemiology Outlook 2021- 2030 - ResearchAndMarkets.com,https://www.businesswire.com/news/home/20211001005614/en/Global-Hunter-Syndrome-Epidemiology-Outlook-2021--2030---ResearchAndMarkets.com,10/01/2021 , 12:55 PM
エムファイン、インド最大のバーチャル病院を構築すべくシリーズCで4800万米ドルを調達,https://www.businesswire.com/news/home/20211001005612/ja,10/01/2021 , 12:47 PM
Global Airport Security Technologies & Market (with COVID-19 Impact) 2021-2026 - ResearchAndMarkets.com,https://www.businesswire.com/news/home/20211001005611/en/Global-Airport-Security-Technologies-Market-with-COVID-19-Impact-2021-2026---ResearchAndMarkets.com,10/01/2021 , 12:46 PM
GML e EZ-WHEEL se associam para lançar uma roda motriz exclusiva alimentada por IA para robôs móveis autônomos,https://www.businesswire.com/news/home/20211001005610/pt,10/01/2021 , 12:44 PM
Carlsmed Announces aprevo® Launch and NTAP Reimbursement,https://www.businesswire.com/news/home/20211001005608/en/Carlsmed-Announces-aprevo%C2%AE-Launch-and-NTAP-Reimbursement,10/01/2021 , 12:40 PM
Commonwealth Care Alliance® Introduces Range of Medicare Plans for Rhode Islanders in First-Ever Expansion Outside Massachusetts,https://www.businesswire.com/news/home/20211001005607/en/Commonwealth-Care-Alliance%C2%AE-Introduces-Range-of-Medicare-Plans-for-Rhode-Islanders-in-First-Ever-Expansion-Outside-Massachusetts,10/01/2021 , 12:38 PM
Global Cross-Cultural Training Market Poised to Grow by $1.46 Billion During 2021-2025 - ResearchAndMarkets.com,https://www.businesswire.com/news/home/20211001005606/en/Global-Cross-Cultural-Training-Market-Poised-to-Grow-by-1.46-Billion-During-2021-2025---ResearchAndMarkets.com,10/01/2021 , 12:36 PM
"Popular, Inc. to Report Third Quarter Results and Hold Conference Call on Wednesday, October 20, 2021",https://www.businesswire.com/news/home/20211001005605/en/Popular-Inc.-to-Report-Third-Quarter-Results-and-Hold-Conference-Call-on-Wednesday-October-20-2021,10/01/2021 , 12:36 PM
The Law Offices of Frank R. Cruz Reminds Investors of Looming Deadline in the Class Action Lawsuit Against Zymergen Inc. (ZY),https://www.businesswire.com/news/home/20211001005004/en/The-Law-Offices-of-Frank-R.-Cruz-Reminds-Investors-of-Looming-Deadline-in-the-Class-Action-Lawsuit-Against-Zymergen-Inc.-ZY,10/01/2021 , 12:35 PM
"Global Psychedelic Drugs Market Review and Outlook, 2021 | Featuring Profiles of Jazz Pharma, PharmaTher Holdings, ATAI LIFE SCIENCES, COMPASS Pathways, Mind Medicine, and Janssen Pharma - ResearchAndMarkets.com",https://www.businesswire.com/news/home/20211001005602/en/Global-Psychedelic-Drugs-Market-Review-and-Outlook-2021-Featuring-Profiles-of-Jazz-Pharma-PharmaTher-Holdings-ATAI-LIFE-SCIENCES-COMPASS-Pathways-Mind-Medicine-and-Janssen-Pharma---ResearchAndMarkets.com,10/01/2021 , 12:35 PM
"Global Oncology Partnering Deal Trends, Players and Financials 2021- 2025 - ResearchAndMarkets.com",https://www.businesswire.com/news/home/20211001005601/en/Global-Oncology-Partnering-Deal-Trends-Players-and-Financials-2021--2025---ResearchAndMarkets.com,10/01/2021 , 12:35 PM
AM Best Revises Issuer Credit Rating Outlook to Positive for Zurich Insurance Group Ltd and Its Main Rated Subsidiaries,https://www.businesswire.com/news/home/20211001005597/en/AM-Best-Revises-Issuer-Credit-Rating-Outlook-to-Positive-for-Zurich-Insurance-Group-Ltd-and-Its-Main-Rated-Subsidiaries,10/01/2021 , 12:32 PM
AM Best Affirms Credit Ratings of Farmers New World Life Insurance Company and Farmers Reinsurance Company,https://www.businesswire.com/news/home/20211001005599/en/AM-Best-Affirms-Credit-Ratings-of-Farmers-New-World-Life-Insurance-Company-and-Farmers-Reinsurance-Company,10/01/2021 , 12:32 PM
"New COVID-19 Probe Must Re-examine the Lab Leak Origin, Says AHF",https://www.businesswire.com/news/home/20211001005598/en/New-COVID-19-Probe-Must-Re-examine-the-Lab-Leak-Origin-Says-AHF,10/01/2021 , 12:32 PM
Fivetran Completes Acquisition of HVR,https://www.businesswire.com/news/home/20211001005217/en/Fivetran-Completes-Acquisition-of-HVR,10/01/2021 , 12:31 PM
"Pershing Square Holdings, Ltd. Announces Closing of €500 Million and $700 Million Senior Notes Offering",https://www.businesswire.com/news/home/20211001005576/en/Pershing-Square-Holdings-Ltd.-Announces-Closing-of-%E2%82%AC500-Million-and-700-Million-Senior-Notes-Offering,10/01/2021 , 12:30 PM
"AM Best Affirms Credit Ratings of Seguros Universales, S.A.",https://www.businesswire.com/news/home/20211001005594/en/AM-Best-Affirms-Credit-Ratings-of-Seguros-Universales-S.A.,10/01/2021 , 12:30 PM
"AM Best Afirma Calificaciones Crediticias de Seguros Universales, S.A.",https://www.businesswire.com/news/home/20211001005595/es,10/01/2021 , 12:30 PM
"CAES Acquires Colorado Engineering, Inc.",https://www.businesswire.com/news/home/20211001005585/en/CAES-Acquires-Colorado-Engineering-Inc.,10/01/2021 , 12:30 PM
"Interactive Brokers Group Reports Brokerage Metrics and Other Financial Information for September 2021, includes Reg.-NMS Execution Statistics",https://www.businesswire.com/news/home/20211001005592/en/Interactive-Brokers-Group-Reports-Brokerage-Metrics-and-Other-Financial-Information-for-September-2021-includes-Reg.-NMS-Execution-Statistics,10/01/2021 , 12:26 PM
Global Pediatric Neuroblastoma Treatment Market Growth Analysis and Insights 2021 - ResearchAndMarkets.com,https://www.businesswire.com/news/home/20211001005591/en/Global-Pediatric-Neuroblastoma-Treatment-Market-Growth-Analysis-and-Insights-2021---ResearchAndMarkets.com,10/01/2021 , 12:25 PM
"North America Plastic Compounding Market 2021: Major Players Include BASF, Kraton Ploymers, Covestro and Asahi Kasei Plastics - ResearchAndMarkets.com",https://www.businesswire.com/news/home/20211001005588/en/North-America-Plastic-Compounding-Market-2021-Major-Players-Include-BASF-Kraton-Ploymers-Covestro-and-Asahi-Kasei-Plastics---ResearchAndMarkets.com,10/01/2021 , 12:23 PM
Xtrackers (IE) plc UK Regulatory Announcement: Net Asset Value(s),https://www.businesswire.com/news/home/20211001005590/en/Xtrackers-IE-plc-UK-Regulatory-Announcement-Net-Asset-Value-s,10/01/2021 , 12:23 PM
Opioid Addiction: Worldwide Markets and Competitive Landscape 2018-2026 - ResearchAndMarkets.com,https://www.businesswire.com/news/home/20211001005589/en/Opioid-Addiction-Worldwide-Markets-and-Competitive-Landscape-2018-2026---ResearchAndMarkets.com,10/01/2021 , 12:23 PM
