Title,Urls,Updated_Date,Updated_Time
Rocky Mountain Chocolate Factory Announces Termination of “Poison Pill” Effective Immediately,https://www.businesswire.com/news/home/20211002005019/en/Rocky-Mountain-Chocolate-Factory-Announces-Termination-of-%E2%80%9CPoison-Pill%E2%80%9D-Effective-Immediately,10/02/2021 , 08:29 PM
Incyte gibt vollständige Ergebnisse des Phase-3-Programms TRuE-V zu Ruxolitinib-Creme (Opzelura™) bei Patienten mit Vitiligo bekannt,https://www.businesswire.com/news/home/20211002005018/de,10/02/2021 , 08:26 PM
Rio Tinto’s iron ore rail cars to be built in WA to boost local jobs,https://www.businesswire.com/news/home/20211002005001/en/Rio-Tinto%E2%80%99s-iron-ore-rail-cars-to-be-built-in-WA-to-boost-local-jobs,10/02/2021 , 07:00 PM
Společnost Johns Manville obnovuje závazek vytvářet lepší budoucnost a v nové zprávě o udržitelnosti stanovuje cíle pro rok 2025,https://www.businesswire.com/news/home/20211002005017/cs,10/02/2021 , 02:32 PM
Seres Therapeutics Presents Late-Breaking Data from SER-109 Phase 3 ECOSPOR III Study in Recurrent C. Difficile Infection at IDWeek2021,https://www.businesswire.com/news/home/20211002005004/en/Seres-Therapeutics-Presents-Late-Breaking-Data-from-SER-109-Phase-3-ECOSPOR-III-Study-in-Recurrent-C.-Difficile-Infection-at-IDWeek2021,10/02/2021 , 01:15 PM
Tesla Q3 2021 Vehicle Production & Deliveries,https://www.businesswire.com/news/home/20211002005015/en/Tesla-Q3-2021-Vehicle-Production-Deliveries,10/02/2021 , 11:33 AM
マベニア、次世代OSSでインテリジェント・ネットワーク・オペレーションを実現,https://www.businesswire.com/news/home/20211002005014/ja,10/02/2021 , 11:08 AM
シュルンベルジェとアヴィバが石油・ガス生産操業のためのデジタル・ソリューションの前進に向けて合意を発表,https://www.businesswire.com/news/home/20211002005013/ja,10/02/2021 , 10:55 AM
Riassunto: Incyte annuncia i risultati completi del programma di fase 3 TRuE-V per la valutazione di ruxolitinib in crema (Opzelura™) nei pazienti con vitiligine,https://www.businesswire.com/news/home/20211002005012/it,10/02/2021 , 10:25 AM
Erklärung der Anwälte Phil Brewster von der Brewster Law Firm und Patrick Mincey von Cranfill Sumner,https://www.businesswire.com/news/home/20211002005011/de,10/02/2021 , 08:11 AM
Inauguration d’une nouvelle ère d’éducation médicale à l’UNTH,https://www.businesswire.com/news/home/20211002005009/fr,10/02/2021 , 07:22 AM
Der Beginn einer neuen Ära in der medizinischen Ausbildung an der NTHU,https://www.businesswire.com/news/home/20211002005010/de,10/02/2021 , 07:22 AM
Riassunto: Al via una nuova era per la formazione medica alla NTHU,https://www.businesswire.com/news/home/20211002005008/it,10/02/2021 , 06:02 AM
Incyte Announces Full Results From Phase 3 TRuE-V Program Evaluating Ruxolitinib Cream (Opzelura™) in Patients With Vitiligo,https://www.businesswire.com/news/home/20211002005006/en/Incyte-Announces-Full-Results-From-Phase-3-TRuE-V-Program-Evaluating-Ruxolitinib-Cream-Opzelura%E2%84%A2-in-Patients-With-Vitiligo,10/02/2021 , 05:15 AM
Kyowa Kirin and Amgen Present Positive Late-Breaking Data from Phase 2 Study of KHK4083/AMG 451 in Adult Patients with Moderate-to-Severe Atopic Dermatitis at EADV Congress,https://www.businesswire.com/news/home/20211002005007/en/Kyowa-Kirin-and-Amgen-Present-Positive-Late-Breaking-Data-from-Phase-2-Study-of-KHK4083AMG-451-in-Adult-Patients-with-Moderate-to-Severe-Atopic-Dermatitis-at-EADV-Congress,10/02/2021 , 05:00 AM
Ushering in a New Era of Medical Education at NTHU,https://www.businesswire.com/news/home/20211001005043/en/Ushering-in-a-New-Era-of-Medical-Education-at-NTHU,10/02/2021 , 01:00 AM
"ZYMERGEN 72 HOUR DEADLINE ALERT: Former Louisiana Attorney General and Kahn Swick & Foti, LLC Remind Investors With Losses in Excess of $100,000 of Deadline in Class Action Lawsuit Against Zymergen Inc. - ZY",https://www.businesswire.com/news/home/20211001005689/en/ZYMERGEN-72-HOUR-DEADLINE-ALERT-Former-Louisiana-Attorney-General-and-Kahn-Swick-Foti-LLC-Remind-Investors-With-Losses-in-Excess-of-100000-of-Deadline-in-Class-Action-Lawsuit-Against-Zymergen-Inc.---ZY,10/01/2021 , 10:50 PM
"GOODRX INVESTIGATION INITIATED by Former Louisiana Attorney General: Kahn Swick & Foti, LLC Investigates the Officers and Directors of GoodRx Holdings, Inc. - GDRX",https://www.businesswire.com/news/home/20211001005694/en/GOODRX-INVESTIGATION-INITIATED-by-Former-Louisiana-Attorney-General-Kahn-Swick-Foti-LLC-Investigates-the-Officers-and-Directors-of-GoodRx-Holdings-Inc.---GDRX,10/01/2021 , 10:50 PM
"ACTIVISION BLIZZARD 72 HOUR DEADLINE ALERT: Former Louisiana Attorney General and Kahn Swick & Foti, LLC Remind Investors With Losses in Excess of $100,000 of Deadline in Class Action Lawsuit Against Activision Blizzard, Inc. - ATVI",https://www.businesswire.com/news/home/20211001005693/en/ACTIVISION-BLIZZARD-72-HOUR-DEADLINE-ALERT-Former-Louisiana-Attorney-General-and-Kahn-Swick-Foti-LLC-Remind-Investors-With-Losses-in-Excess-of-100000-of-Deadline-in-Class-Action-Lawsuit-Against-Activision-Blizzard-Inc.---ATVI,10/01/2021 , 10:50 PM
Amerigroup Increases Access to Whole-Health Benefits in Medicare Advantage Plans to Meet Members’ Unique Healthcare Needs,https://www.businesswire.com/news/home/20211001005034/en/Amerigroup-Increases-Access-to-Whole-Health-Benefits-in-Medicare-Advantage-Plans-to-Meet-Members%E2%80%99-Unique-Healthcare-Needs,10/01/2021 , 10:31 PM
Déclaration des avocats Phil Brewster de Brewster Law Firm et Patrick Mincey de Cranfill Sumner,https://www.businesswire.com/news/home/20211001005770/fr,10/01/2021 , 10:05 PM
Samenvatting: FEELM versterkt zijn toewijding aan innovaties in verstuivings technologie op 2021 UK Media Day,https://www.businesswire.com/news/home/20211001005766/nl,10/01/2021 , 09:05 PM
フェリングが再発性C. Difficile感染症に対する持続的な有効性を一貫して示したRBX2660の臨床試験5件の完全データと、微生物叢特性の好ましい変化を示した複数の解析結果を発表,https://www.businesswire.com/news/home/20211001005765/ja,10/01/2021 , 08:53 PM
ロッキード・マーティン・ベンチャーズとNTTドコモ・ベンチャーズがTileDBのユニバーサルデータベースを前進させるため当社に出資,https://www.businesswire.com/news/home/20211001005764/ja,10/01/2021 , 08:47 PM
MMIT/Evaluate收购Panalgo，为制药分析和决策加快速度，增强信任,https://www.businesswire.com/news/home/20211001005761/zh-CN,10/01/2021 , 08:44 PM
MMIT/Evaluate收購Panalgo，為製藥分析和決策加快速度，增強信任,https://www.businesswire.com/news/home/20211001005762/zh-HK,10/01/2021 , 08:44 PM
MMIT／エバリュエートがペナルゴを買収し、製薬分析と意思決定にスピードと信頼をもたらす,https://www.businesswire.com/news/home/20211001005763/ja,10/01/2021 , 08:44 PM
新しいブライトコーブ・マーケットプレイスが技術パートナーのエコシステムを拡大,https://www.businesswire.com/news/home/20211001005760/ja,10/01/2021 , 08:38 PM
新的BRIGHTCOVE MARKETPLACE扩大技术合作伙伴生态系统,https://www.businesswire.com/news/home/20211001005758/zh-CN,10/01/2021 , 08:37 PM
新的BRIGHTCOVE MARKETPLACE擴大技術合作夥伴生態系統,https://www.businesswire.com/news/home/20211001005759/zh-HK,10/01/2021 , 08:37 PM
Amerigroup Increases Access to Whole-Health Benefits in Medicare Advantage Plans to Meet Members’ Unique Healthcare Needs,https://www.businesswire.com/news/home/20211001005033/en/Amerigroup-Increases-Access-to-Whole-Health-Benefits-in-Medicare-Advantage-Plans-to-Meet-Members%E2%80%99-Unique-Healthcare-Needs,10/01/2021 , 08:31 PM
ニールセンIQがオムニチャネル計測革命のペースを確立,https://www.businesswire.com/news/home/20211001005757/ja,10/01/2021 , 08:27 PM
Declaração dos advogados Phil Brewster da Brewster Law Firm e Patrick Mincey da Cranfill Sumner,https://www.businesswire.com/news/home/20211001005756/pt,10/01/2021 , 08:12 PM
CSC研究發現：因網域名稱安全措施不當，大多數全球超大型企業易受網路釣魚和品牌冒用影響,https://www.businesswire.com/news/home/20211001005754/zh-HK,10/01/2021 , 08:12 PM
CSCの調査で世界最大級の企業の多数にドメインセキュリティー不備によるフィッシングやブランド悪用の危険があると判明,https://www.businesswire.com/news/home/20211001005755/ja,10/01/2021 , 08:12 PM
CSC研究发现：因域名安全措施不当，大多数全球超大型公司易受网络钓鱼和品牌冒用影响,https://www.businesswire.com/news/home/20211001005753/zh-CN,10/01/2021 , 08:11 PM
"CoStar Group acquiert BureauxLocaux, un chef de file des plateformes numériques d'immobilier commercial en France",https://www.businesswire.com/news/home/20211001005752/fr,10/01/2021 , 07:47 PM
The Coretec Group erweitert Vorstand mit Ernennung von Douglas W. Freitag,https://www.businesswire.com/news/home/20211001005751/de,10/01/2021 , 07:22 PM
"SHAREHOLDER ALERT: Robbins LLP Reminds Investors of the Lead Plaintiff Deadline in the Class Action Against View, Inc. (VIEW) f/k/a CF Finance Acquisition Corp. II",https://www.businesswire.com/news/home/20211001005750/en/SHAREHOLDER-ALERT-Robbins-LLP-Reminds-Investors-of-the-Lead-Plaintiff-Deadline-in-the-Class-Action-Against-View-Inc.-VIEW-fka-CF-Finance-Acquisition-Corp.-II,10/01/2021 , 07:16 PM
"DEADLINE ALERT: Bragar Eagel & Squire, P.C. Reminds Investors That a Class Action Lawsuit Has Been Filed Against Zymergen Inc. and Encourages Investors to Contact the Firm",https://www.businesswire.com/news/home/20211001005720/en/DEADLINE-ALERT-Bragar-Eagel-Squire-P.C.-Reminds-Investors-That-a-Class-Action-Lawsuit-Has-Been-Filed-Against-Zymergen-Inc.-and-Encourages-Investors-to-Contact-the-Firm,10/01/2021 , 07:00 PM
"DEADLINE ALERT: Bragar Eagel & Squire, P.C. Reminds Investors that a Class Action Lawsuit Has Been Filed Against Iterum Therapeutics plc and Encourages Investors to Contact the Firm",https://www.businesswire.com/news/home/20211001005738/en/DEADLINE-ALERT-Bragar-Eagel-Squire-P.C.-Reminds-Investors-that-a-Class-Action-Lawsuit-Has-Been-Filed-Against-Iterum-Therapeutics-plc-and-Encourages-Investors-to-Contact-the-Firm,10/01/2021 , 07:00 PM
"HYZON ALERT: Bragar Eagel & Squire, P.C. Announces That a Class Action Lawsuit Has Been Filed Against Hyzon Motors Inc. and Encourages Investors to Contact the Firm",https://www.businesswire.com/news/home/20211001005727/en/HYZON-ALERT-Bragar-Eagel-Squire-P.C.-Announces-That-a-Class-Action-Lawsuit-Has-Been-Filed-Against-Hyzon-Motors-Inc.-and-Encourages-Investors-to-Contact-the-Firm,10/01/2021 , 07:00 PM
"CFRA gibt Übernahme von Washington Analysis, LLC bekannt",https://www.businesswire.com/news/home/20211001005749/de,10/01/2021 , 06:58 PM
"SHAREHOLDER ALERT: Robbins LLP Reminds Investors that Katapult Holdings, Inc. (KPLT) is Being Sued for Misleading Shareholders",https://www.businesswire.com/news/home/20211001005748/en/SHAREHOLDER-ALERT-Robbins-LLP-Reminds-Investors-that-Katapult-Holdings-Inc.-KPLT-is-Being-Sued-for-Misleading-Shareholders,10/01/2021 , 06:57 PM
SHAREHOLDER ALERT: Robbins LLP Reminds Investors that the Lead Plaintiff Deadline is Approaching in the Class Action Against Yalla Group Limited (YALA),https://www.businesswire.com/news/home/20211001005747/en/SHAREHOLDER-ALERT-Robbins-LLP-Reminds-Investors-that-the-Lead-Plaintiff-Deadline-is-Approaching-in-the-Class-Action-Against-Yalla-Group-Limited-YALA,10/01/2021 , 06:55 PM
"Pershing Square Holdings, Ltd. Releases Monthly Net Asset Value and Performance Report for September 2021",https://www.businesswire.com/news/home/20211001005746/en/Pershing-Square-Holdings-Ltd.-Releases-Monthly-Net-Asset-Value-and-Performance-Report-for-September-2021,10/01/2021 , 06:44 PM
"CoStar Group verwerft BureauxLocaux, een toonaangevende digitale marktplaats voor commercieel onroerend goed in Frankrijk",https://www.businesswire.com/news/home/20211001005745/nl,10/01/2021 , 06:32 PM
"TortoiseEcofin Provides Unaudited Balance Sheet Information and Asset Coverage Ratio Updates as of September 30, 2021 for TYG, NTG, TTP, NDP, TPZ and TEAF",https://www.businesswire.com/news/home/20211001005743/en/TortoiseEcofin-Provides-Unaudited-Balance-Sheet-Information-and-Asset-Coverage-Ratio-Updates-as-of-September-30-2021-for-TYG-NTG-TTP-NDP-TPZ-and-TEAF,10/01/2021 , 06:30 PM
'Fashion Futian! Explore Globally' Shenzhen Futian Fashion Investment 2021 Paris Forum met succes gelanceerd,https://www.businesswire.com/news/home/20211001005744/nl,10/01/2021 , 06:29 PM
"Ranger Energy Services, Inc. Completes Acquisition of Basic Energy Services Assets From Chapter 11 Bankruptcy",https://www.businesswire.com/news/home/20211001005742/en/Ranger-Energy-Services-Inc.-Completes-Acquisition-of-Basic-Energy-Services-Assets-From-Chapter-11-Bankruptcy,10/01/2021 , 06:27 PM
"ACCELERON INVESTOR ALERT by the Former Attorney General of Louisiana: Kahn Swick & Foti, LLC Investigates Adequacy of Price and Process in Proposed Sale of Acceleron Pharma Inc. - XLRN",https://www.businesswire.com/news/home/20211001005741/en/ACCELERON-INVESTOR-ALERT-by-the-Former-Attorney-General-of-Louisiana-Kahn-Swick-Foti-LLC-Investigates-Adequacy-of-Price-and-Process-in-Proposed-Sale-of-Acceleron-Pharma-Inc.---XLRN,10/01/2021 , 06:27 PM
"TDCX se prepara para aprovechar las oportunidades del mercado de servicios de CX subcontratados, de 100.000 millones de dólares, con su debut en la Bolsa de Nueva York",https://www.businesswire.com/news/home/20211001005740/es,10/01/2021 , 06:22 PM
Atara Biotherapeutics Reports Inducement Grants Under Nasdaq Listing Rule 5635(C)(4),https://www.businesswire.com/news/home/20211001005739/en/Atara-Biotherapeutics-Reports-Inducement-Grants-Under-Nasdaq-Listing-Rule-5635-C-4,10/01/2021 , 06:14 PM
GROUPE SEB: Securities Repurchasing Programme- Weekly Disclosure Trading in Own Shares From 14 September 2021,https://www.businesswire.com/news/home/20211001005736/en/GROUPE-SEB-Securities-Repurchasing-Programme--Weekly-Disclosure-Trading-in-Own-Shares-From-14-September-2021,10/01/2021 , 06:07 PM
GROUPE SEB : RACHAT D’ACTIONS – DECLARATION HEBDOMADAIRE TRANSACTIONS SUR ACTIONS PROPRES DU 14 SEPTEMBRE 2021,https://www.businesswire.com/news/home/20211001005737/fr,10/01/2021 , 06:07 PM
"Selon l'AHF, la nouvelle enquête sur le COVID-19 doit réexaminer l'hypothèse d'une fuite de laboratoire",https://www.businesswire.com/news/home/20211001005734/fr,10/01/2021 , 06:07 PM
Declaración de los abogados Phil Brewster de Brewster Law Firm y Patrick Mincey de Cranfill Sumner,https://www.businesswire.com/news/home/20211001005733/es,10/01/2021 , 06:06 PM
Wells Fargo Utilities and High Income Fund Announces Sources of Distribution,https://www.businesswire.com/news/home/20211001005732/en/Wells-Fargo-Utilities-and-High-Income-Fund-Announces-Sources-of-Distribution,10/01/2021 , 06:06 PM
"CFRA anuncia la adquisición de Washington Analysis, LLC",https://www.businesswire.com/news/home/20211001005731/es,10/01/2021 , 06:05 PM
"CFRA annonce l'acquisition de Washington Analysis, LLC",https://www.businesswire.com/news/home/20211001005730/fr,10/01/2021 , 06:03 PM
"A CFRA anuncia aquisição da Washington Analysis, LLC",https://www.businesswire.com/news/home/20211001005729/pt,10/01/2021 , 06:01 PM
"CoStar Group Acquisisce BureauxLocaux, uno dei principali mercati digitali di proprietà commerciali in Francia",https://www.businesswire.com/news/home/20211001005728/it,10/01/2021 , 05:58 PM
Physicians Realty Trust Announces Agreement to Purchase Medical Office Portfolio for $764 Million,https://www.businesswire.com/news/home/20211001005726/en/Physicians-Realty-Trust-Announces-Agreement-to-Purchase-Medical-Office-Portfolio-for-764-Million,10/01/2021 , 05:56 PM
"$13.5 Million Apartment Community in Sacramento, CA Sold by TMG",https://www.businesswire.com/news/home/20211001005725/en/13.5-Million-Apartment-Community-in-Sacramento-CA-Sold-by-TMG,10/01/2021 , 05:55 PM
"Vivint Smart Home to Participate in InsureTech Connect (ITC), the World’s Largest Gathering of Insurance Leaders and Innovators",https://www.businesswire.com/news/home/20211001005723/en/Vivint-Smart-Home-to-Participate-in-InsureTech-Connect-ITC-the-World%E2%80%99s-Largest-Gathering-of-Insurance-Leaders-and-Innovators,10/01/2021 , 05:50 PM
BaCo Tech Is the Time Machine the Public Accounting Industry Has Been Looking For,https://www.businesswire.com/news/home/20211001005722/en/BaCo-Tech-Is-the-Time-Machine-the-Public-Accounting-Industry-Has-Been-Looking-For,10/01/2021 , 05:49 PM
"Domtar Corporation and Karta Halten B.V., Through Its Subsidiary Pearl Merger Sub Inc., Announce the Pricing of Private Offering of Senior Secured Notes Due 2028",https://www.businesswire.com/news/home/20211001005721/en/Domtar-Corporation-and-Karta-Halten-B.V.-Through-Its-Subsidiary-Pearl-Merger-Sub-Inc.-Announce-the-Pricing-of-Private-Offering-of-Senior-Secured-Notes-Due-2028,10/01/2021 , 05:48 PM
U.S. FDA Approves Kite’s Tecartus® as the First and Only Car T for Adults With Relapsed or Refractory B-cell Acute Lymphoblastic Leukemia,https://www.businesswire.com/news/home/20211001005719/en/U.S.-FDA-Approves-Kite%E2%80%99s-Tecartus%C2%AE-as-the-First-and-Only-Car-T-for-Adults-With-Relapsed-or-Refractory-B-cell-Acute-Lymphoblastic-Leukemia,10/01/2021 , 05:46 PM
Blackstone Secured Lending Fund Files Registration Statement for Initial Public Offering,https://www.businesswire.com/news/home/20211001005718/en/Blackstone-Secured-Lending-Fund-Files-Registration-Statement-for-Initial-Public-Offering,10/01/2021 , 05:38 PM
"AM Best Retira las Calificaciones Crediticias de XL Seguros México, S.A. de C.V.",https://www.businesswire.com/news/home/20211001005717/es,10/01/2021 , 05:33 PM
"AM Best Withdraws Credit Ratings of XL Seguros México, S.A. de C.V.",https://www.businesswire.com/news/home/20211001005716/en/AM-Best-Withdraws-Credit-Ratings-of-XL-Seguros-M%C3%A9xico-S.A.-de-C.V.,10/01/2021 , 05:32 PM
"Nieuwe COVID-19-sonde moet de oorsprong van lekkage in het laboratorium opnieuw onderzoeken, zegt AHF",https://www.businesswire.com/news/home/20211001005715/nl,10/01/2021 , 05:26 PM
"È stato lanciato “La moda di Futian! Esplorazione globale”, il forum parigino 2021 per gli investimenti nella moda di Shenzhen Futian",https://www.businesswire.com/news/home/20211001005714/it,10/01/2021 , 05:17 PM
CORRECTING and REPLACING Oscar Announces Partnerships With Leading Chicago Area Health Systems to Offer Affordable Health Insurance and Care,https://www.businesswire.com/news/home/20210930005021/en/CORRECTING-and-REPLACING-Oscar-Announces-Partnerships-With-Leading-Chicago-Area-Health-Systems-to-Offer-Affordable-Health-Insurance-and-Care,10/01/2021 , 05:15 PM
Riassunto: Dichiarazione rilasciata dai consulenti legali Phil Brewster di Brewster Law Firm e Patrick Mincey di Cranfill Sumner,https://www.businesswire.com/news/home/20211001005713/it,10/01/2021 , 05:10 PM
BMW of North America Reports Q3 2021 U.S. Sales Results,https://www.businesswire.com/news/home/20211001005712/en/BMW-of-North-America-Reports-Q3-2021-U.S.-Sales-Results,10/01/2021 , 05:00 PM
Distribution Dates and Amounts Announced for Certain BlackRock Closed-End Funds,https://www.businesswire.com/news/home/20211001005698/en/Distribution-Dates-and-Amounts-Announced-for-Certain-BlackRock-Closed-End-Funds,10/01/2021 , 05:00 PM
"Barnes Group Inc. to Host Virtual Investor Day on December 14, 2021",https://www.businesswire.com/news/home/20211001005711/en/Barnes-Group-Inc.-to-Host-Virtual-Investor-Day-on-December-14-2021,10/01/2021 , 04:59 PM
Retail Value Inc. Announces Sale of Continental U.S. Property Portfolio and Declares Dividends on Series A Preferred Shares and Common Shares,https://www.businesswire.com/news/home/20211001005710/en/Retail-Value-Inc.-Announces-Sale-of-Continental-U.S.-Property-Portfolio-and-Declares-Dividends-on-Series-A-Preferred-Shares-and-Common-Shares,10/01/2021 , 04:59 PM
KBRA Assigns Preliminary Ratings to Sequoia Mortgage Trust 2021-7 (SEMT 2021-7),https://www.businesswire.com/news/home/20211001005709/en/KBRA-Assigns-Preliminary-Ratings-to-Sequoia-Mortgage-Trust-2021-7-SEMT-2021-7,10/01/2021 , 04:57 PM
Douglas Emmett Announces Dates for Its 2021 Third Quarter Earnings Results and Live Conference Call,https://www.businesswire.com/news/home/20211001005708/en/Douglas-Emmett-Announces-Dates-for-Its-2021-Third-Quarter-Earnings-Results-and-Live-Conference-Call,10/01/2021 , 04:55 PM
"CoStar Group übernimmt BureauxLocaux, einen führenden digitalen Marktplatz für Gewerbeimmobilien in Frankreich",https://www.businesswire.com/news/home/20211001005707/de,10/01/2021 , 04:48 PM
First BanCorp. Announces Payment of Dividends on Preferred Stock,https://www.businesswire.com/news/home/20211001005673/en/First-BanCorp.-Announces-Payment-of-Dividends-on-Preferred-Stock,10/01/2021 , 04:45 PM
Sensient Announces Conference Call,https://www.businesswire.com/news/home/20211001005704/en/Sensient-Announces-Conference-Call,10/01/2021 , 04:42 PM
Avalara Acquires Track1099 to Help Businesses Manage IRS Form Filing Requirements,https://www.businesswire.com/news/home/20211001005703/en/Avalara-Acquires-Track1099-to-Help-Businesses-Manage-IRS-Form-Filing-Requirements,10/01/2021 , 04:39 PM
Dicerna Reports Inducement Grants Under Nasdaq Listing Rule 5635(c)(4),https://www.businesswire.com/news/home/20211001005702/en/Dicerna-Reports-Inducement-Grants-Under-Nasdaq-Listing-Rule-5635-c-4,10/01/2021 , 04:38 PM
LegalShield Associates Come Together in Phoenix October 1-3 for the 2021 Leadership Convention,https://www.businesswire.com/news/home/20211001005449/en/LegalShield-Associates-Come-Together-in-Phoenix-October-1-3-for-the-2021-Leadership-Convention,10/01/2021 , 04:30 PM
Badger Meter Schedules Third Quarter 2021 Earnings Call,https://www.businesswire.com/news/home/20211001005493/en/Badger-Meter-Schedules-Third-Quarter-2021-Earnings-Call,10/01/2021 , 04:30 PM
LGL Announces Approval of Spin-off and Holdings of IRNT Shares,https://www.businesswire.com/news/home/20211001005697/en/LGL-Announces-Approval-of-Spin-off-and-Holdings-of-IRNT-Shares,10/01/2021 , 04:30 PM
RiverNorth Closed-End Funds Declare Monthly Distributions,https://www.businesswire.com/news/home/20211001005700/en/RiverNorth-Closed-End-Funds-Declare-Monthly-Distributions,10/01/2021 , 04:30 PM
Afya Limited Announces the Acquisition of RX PRO,https://www.businesswire.com/news/home/20211001005701/en/Afya-Limited-Announces-the-Acquisition-of-RX-PRO,10/01/2021 , 04:30 PM
VF Corporation Announces Second Quarter Fiscal 2022 Earnings and Conference Call Date,https://www.businesswire.com/news/home/20211001005066/en/VF-Corporation-Announces-Second-Quarter-Fiscal-2022-Earnings-and-Conference-Call-Date,10/01/2021 , 04:30 PM
ImmunoGen Announces Inducement Grants Under Nasdaq Listing Rule 5635(c)(4),https://www.businesswire.com/news/home/20211001005489/en/ImmunoGen-Announces-Inducement-Grants-Under-Nasdaq-Listing-Rule-5635-c-4,10/01/2021 , 04:30 PM
Angel Oak Dynamic Financial Strategies Income Term Trust Declares October 2021 Distribution,https://www.businesswire.com/news/home/20211001005635/en/Angel-Oak-Dynamic-Financial-Strategies-Income-Term-Trust-Declares-October-2021-Distribution,10/01/2021 , 04:30 PM
Banc of California and Pacific Mercantile Bancorp Announce Receipt of Final Regulatory Approval,https://www.businesswire.com/news/home/20211001005699/en/Banc-of-California-and-Pacific-Mercantile-Bancorp-Announce-Receipt-of-Final-Regulatory-Approval,10/01/2021 , 04:20 PM
AvalonBay Communities Announces Third Quarter 2021 Earnings Release Date,https://www.businesswire.com/news/home/20211001005637/en/AvalonBay-Communities-Announces-Third-Quarter-2021-Earnings-Release-Date,10/01/2021 , 04:15 PM
H&E Equipment Services Completes Sale of Crane Business,https://www.businesswire.com/news/home/20211001005081/en/HE-Equipment-Services-Completes-Sale-of-Crane-Business,10/01/2021 , 04:15 PM
MFS Announces Closed-End Fund Distributions,https://www.businesswire.com/news/home/20211001005677/en/MFS-Announces-Closed-End-Fund-Distributions,10/01/2021 , 04:15 PM
XAI Octagon Floating Rate & Alternative Income Term Trust Declares its Monthly Common Shares Distribution and Quarterly Preferred Shares Dividend,https://www.businesswire.com/news/home/20211001005067/en/XAI-Octagon-Floating-Rate-Alternative-Income-Term-Trust-Declares-its-Monthly-Common-Shares-Distribution-and-Quarterly-Preferred-Shares-Dividend,10/01/2021 , 04:15 PM
"Elmer Bancorp, Inc. Announces Cash Dividend",https://www.businesswire.com/news/home/20211001005676/en/Elmer-Bancorp-Inc.-Announces-Cash-Dividend,10/01/2021 , 04:15 PM
"ADDING MULTIMEDIA BNP Paribas Opens Expanded New Office in Chesterbook, PA",https://www.businesswire.com/news/home/20211001005140/en/ADDING-MULTIMEDIA-BNP%C2%A0Paribas-Opens-Expanded-New-Office-in-Chesterbook-PA,10/01/2021 , 04:13 PM
NI Announces Upcoming Events With the Financial Community,https://www.businesswire.com/news/home/20211001005008/en/NI-Announces-Upcoming-Events-With-the-Financial-Community,10/01/2021 , 04:10 PM
Arco Receives Antitrust Approval and Completes the Acquisition of COC and Dom Bosco Learning Systems,https://www.businesswire.com/news/home/20211001005696/en/Arco-Receives-Antitrust-Approval-and-Completes-the-Acquisition-of-COC-and-Dom-Bosco-Learning-Systems,10/01/2021 , 04:06 PM
Verisign to Report Third Quarter 2021 Financial Results,https://www.businesswire.com/news/home/20211001005153/en/Verisign-to-Report-Third-Quarter-2021-Financial-Results,10/01/2021 , 04:05 PM
